                                                                                 EXPERIMENT 4--DML COMMAND--UPDATE --DATE-26/04/2022
                                                                                --------------------------------------------------------------------------------------------
--------------------------------------------------------------------------------------------------------------------------------------------------------------------------------------------------------------------------------------------------------
1)UPDATE THE PRICE OF A PARTICULAR PRODUCT

mysql> SELECT * FROM PRODUCT;
+-----+------------+-------+
| PID | PNAME      | PRICE |
+-----+------------+-------+
|   1 | HORLICKS   |   204 |
|   2 | BOOST      |   122 |
|   3 | COMPLAN    |   122 |
|   4 | BONVITA    |   235 |
|   5 | CORNFLAKES |    82 |
+-----+------------+-------+
5 rows in set (0.00 sec)

mysql> UPDATE PRODUCT SET PRICE=100 WHERE PNAME='BOOST';
Query OK, 1 row affected (0.08 sec)
Rows matched: 1  Changed: 1  Warnings: 0

mysql> SELECT * FROM PRODUCT;
+-----+------------+-------+
| PID | PNAME      | PRICE |
+-----+------------+-------+
|   1 | HORLICKS   |   204 |
|   2 | BOOST      |   100 |
|   3 | COMPLAN    |   122 |
|   4 | BONVITA    |   235 |
|   5 | CORNFLAKES |    82 |
+-----+------------+-------+
5 rows in set (0.00 sec)


--------------------------------------------------------------------------------------------------------------------------------------------------------------------------------------------------------------------------------------------------------

 2)CHANGE THE NAME OF CITY  'CLT' TO KOZHIKODE IN THE CUSTOMER TABLE

mysql>  UPDATE CUSTOMER SET CITY='KOZHIKODE' WHERE CITY='CLT';
Query OK, 4 rows affected (0.04 sec)
Rows matched: 4  Changed: 4  Warnings: 0

mysql> SELECT * FROM CUSTOMER;
+----+----------+----------------+-----------+-----------+
| ID | NAME     | ADDRESS        | CITY      | PH_NO     |
+----+----------+----------------+-----------+-----------+
|  1 | ARJUN    | OOTY           | KOZHIKODE | 111112222 |
|  2 | ASWIN    | MUKKAM         | KANNUR    |  92812233 |
|  3 | ABIN     | CHUNGAM        | THISSUR   |    984766 |
|  4 | MANU     | KL12           | KOZHIKODE |   8123467 |
|  6 | SHIBU    | KL17           | IDY       |   4567887 |
|  7 | MAYAN    | MANASSREI      | EKM       |  82819612 |
|  8 | SUGHUNAN | NIT            | TVM       |  92319618 |
|  9 | NANU     | CHATHAMANGALAM | KOZHIKODE |      NULL |
| 10 | MALU     | KOVALAM        | TVM       |     45692 |
| 11 | ARCHANA  | KL18           | KOZHIKODE |   9468910 |
| 12 | ARYA     | KL13           | KANNUR    |  88456712 |
| 13 | MALIK    | KL13           | KANNUR    |  88456712 |
| 14 | NANDU    | KL18           | KOZHIKODE |   8234412 |
+----+----------+----------------+-----------+-----------+
13 rows in set (0.00 sec)

--------------------------------------------------------------------------------------------------------------------------------------------------------------------------------------------------------------------------------------------------------

 3)Update all prices with 2% of its original price. 

mysql> SELECT * FROM PRODUCT;
+-----+------------+-------+
| PID | PNAME      | PRICE |
+-----+------------+-------+
|   1 | HORLICKS   |   200 |
|   2 | BOOST      |   120 |
|   3 | COMPLAN    |   120 |
|   4 | BONVITA    |   230 |
|   5 | CORNFLAKES |    80 |
+-----+------------+-------+
5 rows in set (0.00 sec)

mysql> UPDATE PRODUCT SET PRICE=PRICE*1.02;
Query OK, 5 rows affected (0.03 sec)
Rows matched: 5  Changed: 5  Warnings: 0

mysql> SELECT * FROM PRODUCT;
+-----+------------+-------+
| PID | PNAME      | PRICE |
+-----+------------+-------+
|   1 | HORLICKS   |   204 |
|   2 | BOOST      |   122 |
|   3 | COMPLAN    |   122 |
|   4 | BONVITA    |   235 |
|   5 | CORNFLAKES |    82 |
+-----+------------+-------+
5 rows in set (0.00 sec)
--------------------------------------------------------------------------------------------------------------------------------------------------------------------------------------------------------------------------------------------------------

4)Change the address, city, phone number of a particular customer. 

mysql> SELECT * FROM CUSTOMER;
+----+-------+---------+-----------+----------+
| ID | NAME  | ADDRESS | CITY      | PH_NO    |
+----+-------+---------+-----------+----------+
|  2 | ASWIN | MUKKAM  | KANNUR    | 92812233 |
|  3 | ABIN  | HHHT14  | TVM       |    12367 |
|  4 | MANU  | KL12    | KOZHIKODE |  8123467 |
|  6 | SHIBU | KL17    | IDY       |  4567887 |
+----+-------+---------+-----------+----------+
4 rows in set (0.00 sec)

mysql> UPDATE CUSTOMER SET ADDRESS='CHUNGAM',CITY='THISSUR',PH_NO=984766 WHERE NAME='ABIN';
Query OK, 1 row affected (0.03 sec)
Rows matched: 1  Changed: 1  Warnings: 0

mysql> SELECT * FROM CUSTOMER;
+----+-------+---------+-----------+----------+
| ID | NAME  | ADDRESS | CITY      | PH_NO    |
+----+-------+---------+-----------+----------+
|  2 | ASWIN | MUKKAM  | KANNUR    | 92812233 |
|  3 | ABIN  | CHUNGAM | THISSUR   |   984766 |
|  4 | MANU  | KL12    | KOZHIKODE |  8123467 |
|  6 | SHIBU | KL17    | IDY       |  4567887 |
+----+-------+---------+-----------+----------+
4 rows in set (0.00 sec)

--------------------------------------------------------------------------------------------------------------------------------------------------------------------------------------------------------------------------------------------------------
 5) Change the quantity of a purchased product of inv_id ‘1’

mysql> SELECT * FROM INVOICE_ITEM;
+--------+------+----------+
| INV_ID | PID  | QUANTITY |
+--------+------+----------+
|      1 |    1 |       10 |
|      6 |    4 |        7 |
|      4 |    4 |        6 |
|      5 |    5 |        7 |
|      1 |    5 |       10 |
|      4 |    5 |       13 |
|      4 |    1 |       10 |
|      6 |    1 |       13 |
+--------+------+----------+
8 rows in set (0.00 sec)

mysql> UPDATE INVOICE_ITEM SET QUANTITY=20 WHERE INV_ID=1 AND PID=1 ;
Query OK, 1 row affected (0.03 sec)
Rows matched: 1  Changed: 1  Warnings: 0

mysql> SELECT * FROM INVOICE_ITEM;
+--------+------+----------+
| INV_ID | PID  | QUANTITY |
+--------+------+----------+
|      1 |    1 |       20 |
|      6 |    4 |        7 |
|      4 |    4 |        6 |
|      5 |    5 |        7 |
|      1 |    5 |       10 |
|      4 |    5 |       13 |
|      4 |    1 |       10 |
|      6 |    1 |       13 |
+--------+------+----------+
8 rows in set (0.00 sec)

--------------------------------------------------------------------------------------------------------------------------------------------------------------------------------------------------------------------------------------------------------


//VERIFIED

