                                                                                  EXPERIMENT 5-DML COMMAND-DELETE                                                      DATE-27/04/2022
                                                                                  ------------------------------------------------------------

1)1. Delete the record of customer id ‘1’.

mysql> SELECT * FROM CUSTOMER;
+----+-------+-------------+-----------+----------+
| ID | NAME  | ADDRESS     | CITY      | PH_NO    |
+----+-------+-------------+-----------+----------+
|  1 | ANAND | OAM NIVAS10 | VATAKARA  |   828196 |
|  2 | ASWIN | MUKKAM      | KANNUR    | 92812233 |
|  3 | ABIN  | HHHT14      | TVM       |    12367 |
|  4 | MANU  | KL12        | KOZHIKODE |  8123467 |
|  5 | ARJUN | KL14        | VALAT     |   566787 |
|  6 | SHIBU | KL17        | IDY       |  4567887 |
|  7 | SUBUU | KL37        | WLUYY     |     NULL |
+----+-------+-------------+-----------+----------+
7 rows in set (0.00 sec)

mysql> DELETE FROM CUSTOMER WHERE ID=1;
Query OK, 1 row affected (0.04 sec)

mysql> SELECT * FROM CUSTOMER;
+----+-------+---------+-----------+----------+
| ID | NAME  | ADDRESS | CITY      | PH_NO    |
+----+-------+---------+-----------+----------+
|  2 | ASWIN | MUKKAM  | KANNUR    | 92812233 |
|  3 | ABIN  | HHHT14  | TVM       |    12367 |
|  4 | MANU  | KL12    | KOZHIKODE |  8123467 |
|  5 | ARJUN | KL14    | VALAT     |   566787 |
|  6 | SHIBU | KL17    | IDY       |  4567887 |
|  7 | SUBUU | KL37    | WLUYY     |     NULL |
+----+-------+---------+-----------+----------+
6 rows in set (0.00 sec)

--------------------------------------------------------------------------------------------------------------------------------------------------------------------------------------------------------------------------------------------------------
2). Delete all purchase details of items its quantity less than 6. 

mysql> SELECT * FROM INVOICE_ITEM;
+--------+------+----------+
| INV_ID | PID  | QUANTITY |
+--------+------+----------+
|      1 |    1 |       10 |
|      2 |    1 |        5 |
|      6 |    4 |        7 |
|      4 |    4 |        6 |
|      5 |    5 |        7 |
|      1 |    5 |       10 |
|      4 |    5 |       13 |
|      4 |    1 |       10 |
|      5 |    2 |        4 |
|      6 |    1 |       13 |
|      6 |    2 |       22 |
|      7 |    3 |      200 |
|      7 |    3 |      200 |
+--------+------+----------+
13 rows in set (0.00 sec)

mysql> DELETE FROM INVOICE_ITEM WHERE QUANTITY <6;
Query OK, 2 rows affected (0.03 sec)

mysql> SELECT * FROM INVOICE_ITEM;
+--------+------+----------+
| INV_ID | PID  | QUANTITY |
+--------+------+----------+
|      1 |    1 |       10 |
|      6 |    4 |        7 |
|      4 |    4 |        6 |
|      5 |    5 |        7 |
|      1 |    5 |       10 |
|      4 |    5 |       13 |
|      4 |    1 |       10 |
|      6 |    1 |       13 |
|      6 |    2 |       22 |
|      7 |    3 |      200 |
|      7 |    3 |      200 |
+--------+------+----------+
11 rows in set (0.00 sec)
-------------------------------------------------------------------------------------------------------------------------------------------------------------------------------------------------------------------------------------------------------
3)Delete the purchase details of product ‘BOOST’ in the inv_id ‘6’. 

mysql> SELECT * FROM INVOICE_ITEM;
+--------+------+----------+
| INV_ID | PID  | QUANTITY |
+--------+------+----------+
|      1 |    1 |       10 |
|      6 |    4 |        7 |
|      4 |    4 |        6 |
|      5 |    5 |        7 |
|      1 |    5 |       10 |
|      4 |    5 |       13 |
|      4 |    1 |       10 |
|      6 |    1 |       13 |
|      6 |    2 |       22 |
|      7 |    3 |      200 |
|      7 |    3 |      200 |
+--------+------+----------+
11 rows in set (0.00 sec)

mysql> SELECT * FROM PRODUCT;
+-----+------------+-------+
| PID | PNAME      | PRICE |
+-----+------------+-------+
|   1 | HORLICKS   |   204 |
|   2 | BOOST      |   122 |
|   3 | COMPLAN    |   122 |
|   4 | BONVITA    |   235 |
|   5 | CORNFLAKES |    82 |
+-----+------------+-------+
5 rows in set (0.00 sec)

mysql> DELETE FROM INVOICE_ITEM WHERE INV_ID=6 AND PID=2;
Query OK, 1 row affected (0.04 sec)

mysql> SELECT * FROM INVOICE_ITEM;
+--------+------+----------+
| INV_ID | PID  | QUANTITY |
+--------+------+----------+
|      1 |    1 |       10 |
|      6 |    4 |        7 |
|      4 |    4 |        6 |
|      5 |    5 |        7 |
|      1 |    5 |       10 |
|      4 |    5 |       13 |
|      4 |    1 |       10 |
|      6 |    1 |       13 |
|      7 |    3 |      200 |
|      7 |    3 |      200 |
+--------+------+----------+
10 rows in set (0.00 sec)

-------------------------------------------------------------------------------------------------------------------------------------------------------------------------------------------------------------------------------------------------------
4)Delete details of employees who does not have phone number. 

mysql> SELECT * FROM CUSTOMER;
+----+-------+---------+-----------+----------+
| ID | NAME  | ADDRESS | CITY      | PH_NO    |
+----+-------+---------+-----------+----------+
|  2 | ASWIN | MUKKAM  | KANNUR    | 92812233 |
|  3 | ABIN  | HHHT14  | TVM       |    12367 |
|  4 | MANU  | KL12    | KOZHIKODE |  8123467 |
|  5 | ARJUN | KL14    | VALAT     |   566787 |
|  6 | SHIBU | KL17    | IDY       |  4567887 |
|  7 | SUBUU | KL37    | WLUYY     |     NULL |
+----+-------+---------+-----------+----------+
6 rows in set (0.00 sec)

mysql> DELETE FROM CUSTOMER WHERE PH_NO IS NULL;
Query OK, 1 row affected (0.03 sec)

mysql> SELECT * FROM CUSTOMER;
+----+-------+---------+-----------+----------+
| ID | NAME  | ADDRESS | CITY      | PH_NO    |
+----+-------+---------+-----------+----------+
|  2 | ASWIN | MUKKAM  | KANNUR    | 92812233 |
|  3 | ABIN  | HHHT14  | TVM       |    12367 |
|  4 | MANU  | KL12    | KOZHIKODE |  8123467 |
|  5 | ARJUN | KL14    | VALAT     |   566787 |
|  6 | SHIBU | KL17    | IDY       |  4567887 |
+----+-------+---------+-----------+----------+
5 rows in set (0.00 sec)

--------------------------------------------------------------------------------------------------------------------------------------------------------------------------------------------------------------------------------------------------------------
5)Delete all records from STUDENT table. 

mysql> SELECT * FROM STUDENT;
+---------+---------+-----+--------+
| ROLL_NO | NAME    | AGE | GENDER |
+---------+---------+-----+--------+
|       1 | ASWIN   |  22 | M      |
|       2 | ASWIN   |  22 | M      |
|       3 | AMRITHA |  22 | F      |
|       4 | SCISSNA |  22 | F      |
|       5 | SANAN   |  22 | M      |
+---------+---------+-----+--------+
5 rows in set (0.01 sec)

mysql> DELETE FROM STUDENT;
Query OK, 5 rows affected (0.04 sec)

mysql> SELECT * FROM STUDENT;
Empty set (0.00 sec)



-------------------------------------------------------------------------------------------------------------------------------------------------------------------------------------------------------------------------------------------------------
6)Delete Invoice details of a particular customer. 

mysql> SELECT * FROM INVOICE_ITEM;
+--------+------+----------+
| INV_ID | PID  | QUANTITY |
+--------+------+----------+
|      1 |    1 |       20 |
|      6 |    4 |        7 |
|      4 |    4 |        6 |
|      5 |    5 |        7 |
|      1 |    5 |       10 |
|      4 |    5 |       13 |
|      4 |    1 |       10 |
|      6 |    1 |       13 |
+--------+------+----------+
8 rows in set (0.00 sec)

mysql> DELETE FROM INVOICE_ITEM WHERE INV_ID=6;
Query OK, 2 rows affected (0.04 sec)

mysql> SELECT * FROM INVOICE_ITEM;
+--------+------+----------+
| INV_ID | PID  | QUANTITY |
+--------+------+----------+
|      1 |    1 |       20 |
|      4 |    4 |        6 |
|      5 |    5 |        7 |
|      1 |    5 |       10 |
|      4 |    5 |       13 |
|      4 |    1 |       10 |
+--------+------+----------+
6 rows in set (0.00 sec)

mysql> SELECT * FROM INVOICE_MASTER;
+--------+---------+------------+
| INV_ID | CUST_ID | INV_DATE   |
+--------+---------+------------+
|      1 |       2 | 2022-01-11 |
|      4 |       2 | 2022-02-02 |
|      5 |       2 | 2022-02-04 |
|      6 |       3 | 2022-03-04 |
|      7 |       2 | 2022-03-22 |
+--------+---------+------------+
5 rows in set (0.00 sec)

mysql> DELETE FROM INVOICE_MASTER WHERE CUST_ID=3;
Query OK, 1 row affected (0.03 sec)

mysql> SELECT * FROM INVOICE_MASTER;
+--------+---------+------------+
| INV_ID | CUST_ID | INV_DATE   |
+--------+---------+------------+
|      1 |       2 | 2022-01-11 |
|      4 |       2 | 2022-02-02 |
|      5 |       2 | 2022-02-04 |
|      7 |       2 | 2022-03-22 |
+--------+---------+------------+
4 rows in set (0.00 sec)

--------------------------------------------------------------------------------------------------------------------------------------------------------------------------------------------------------------------------------------------------------
7)Delete the first two records of INVOICE_ITEM table its purchase quantity is high.


mysql> SELECT * FROM INVOICE_ITEM ORDER BY QUANTITY DESC;
+--------+------+----------+
| INV_ID | PID  | QUANTITY |
+--------+------+----------+
|      1 |    1 |       20 |
|      4 |    5 |       13 |
|      1 |    5 |       10 |
|      4 |    1 |       10 |
|      5 |    5 |        7 |
|      4 |    4 |        6 |
+--------+------+----------+
6 rows in set (0.00 sec)



mysql> DELETE FROM INVOICE_ITEM ORDER BY QUANTITY DESC LIMIT 2;
Query OK, 2 rows affected (0.03 sec)

mysql> SELECT * FROM INVOICE_ITEM;
+--------+------+----------+
| INV_ID | PID  | QUANTITY |
+--------+------+----------+
|      4 |    4 |        6 |
|      5 |    5 |        7 |
|      1 |    5 |       10 |
|      4 |    1 |       10 |
+--------+------+----------+
4 rows in set (0.00 sec)

--------------------------------------------------------------------------------------------------------------------------------------------------------------------------------------------------------------------------------------------------------



